{
  "schemaVersion": 1,
  "titleId": "CUSA42503",
  "name": "Atomfall Deluxe Edition",
  "regions": [],
  "aliases": [],
  "platforms": [
    "PS4"
  ],
  "metadataSource": "goldhen-import",
  "metadataUpdatedAt": "2026-05-02T10:01:33Z",
  "notes": "Generated from GoldHEN_Cheat_Repository import."
}
