{
  "schemaVersion": 1,
  "titleId": "PPSA10662",
  "name": "The Last of Us Part II Remastered",
  "regions": [],
  "aliases": [],
  "notes": "Generated from published cheat metadata.",
  "platforms": [
    "PS5"
  ],
  "metadataSource": "published-manifest",
  "metadataUpdatedAt": "2026-04-30T09:57:04Z"
}
