{
  "schemaVersion": 1,
  "titleId": "CUSA00434",
  "name": "Diablo III: Reaper of Souls – Ultimate Evil Edition",
  "regions": [],
  "aliases": [],
  "platforms": [
    "PS4"
  ],
  "metadataSource": "goldhen-import",
  "metadataUpdatedAt": "2026-05-02T10:01:30Z",
  "notes": "Generated from GoldHEN_Cheat_Repository import."
}
