{
  "schemaVersion": 1,
  "titleId": "CUSA08413",
  "name": "Guns Gore and Cannoli 2",
  "regions": [],
  "aliases": [],
  "platforms": [
    "PS4"
  ],
  "metadataSource": "goldhen-import",
  "metadataUpdatedAt": "2026-05-02T10:01:31Z",
  "notes": "Generated from GoldHEN_Cheat_Repository import."
}
