{
  "schemaVersion": 1,
  "titleId": "CUSA13079",
  "name": "Ni no Kuni Wrath of the White Witch™ Remastered",
  "regions": [],
  "aliases": [],
  "platforms": [
    "PS4"
  ],
  "metadataSource": "goldhen-import",
  "metadataUpdatedAt": "2026-05-02T10:01:31Z",
  "notes": "Generated from GoldHEN_Cheat_Repository import."
}
