{
  "schemaVersion": 1,
  "titleId": "CUSA48223",
  "name": "Ender Magnolia: Bloom in the Mist",
  "regions": [],
  "aliases": [],
  "platforms": [
    "PS4"
  ],
  "metadataSource": "goldhen-import",
  "metadataUpdatedAt": "2026-05-02T10:01:34Z",
  "notes": "Generated from GoldHEN_Cheat_Repository import."
}
