{
  "schemaVersion": 1,
  "titleId": "CUSA01867",
  "name": "UP2200-CUSA01867_00-SHOVELKNIGHT0001",
  "regions": [],
  "aliases": [],
  "platforms": [
    "PS4"
  ],
  "metadataSource": "goldhen-import",
  "metadataUpdatedAt": "2026-05-02T10:01:30Z",
  "notes": "Generated from GoldHEN_Cheat_Repository import."
}
