{
  "schemaVersion": 1,
  "titleId": "CUSA27788",
  "name": "BPM Bullets Per Minute",
  "regions": [],
  "aliases": [],
  "platforms": [
    "PS4"
  ],
  "metadataSource": "goldhen-import",
  "metadataUpdatedAt": "2026-05-02T10:01:32Z",
  "notes": "Generated from GoldHEN_Cheat_Repository import."
}
