{
  "schemaVersion": 1,
  "titleId": "PPSA20447",
  "name": "The First Berserker Khazan",
  "regions": [],
  "aliases": [],
  "platforms": [
    "PS5"
  ],
  "metadataSource": "local-loose-import",
  "metadataUpdatedAt": "2026-05-02T10:17:47Z",
  "notes": "Generated from local loose cheat import."
}
