{
  "schemaVersion": 1,
  "titleId": "CUSA00109",
  "name": "Tomb Raider: Definitive Edition",
  "regions": [],
  "aliases": [],
  "platforms": [
    "PS4"
  ],
  "metadataSource": "goldhen-import",
  "metadataUpdatedAt": "2026-05-02T10:01:29Z",
  "notes": "Generated from GoldHEN_Cheat_Repository import."
}
